{
  "$id": "https://agentskeptic.com/schemas/contract-manifest.schema.json",
  "$schema": "https://json-schema.org/draft/2020-12/schema",
  "title": "VerificationContractManifest",
  "type": "object",
  "additionalProperties": false,
  "required": [
    "$schema",
    "manifestVersion",
    "publicUrl",
    "productPackage",
    "members",
    "examples",
    "validatorFingerprint",
    "history"
  ],
  "properties": {
    "$schema": {
      "type": "string",
      "const": "https://agentskeptic.com/schemas/contract-manifest.schema.json"
    },
    "manifestVersion": { "$ref": "#/$defs/semver" },
    "publicUrl": { "type": "string", "format": "uri", "pattern": "^https?://" },
    "productPackage": { "type": "string", "minLength": 1 },
    "members": {
      "type": "object",
      "additionalProperties": false,
      "required": ["event", "toolsRegistry", "toolsRegistryExport"],
      "properties": {
        "event": { "$ref": "#/$defs/memberEntry" },
        "toolsRegistry": { "$ref": "#/$defs/memberEntry" },
        "toolsRegistryExport": { "$ref": "#/$defs/memberEntry" }
      }
    },
    "examples": {
      "type": "object",
      "additionalProperties": false,
      "required": ["registry", "events"],
      "properties": {
        "registry": { "$ref": "#/$defs/exampleEntry" },
        "events": { "$ref": "#/$defs/exampleEntry" }
      }
    },
    "validatorFingerprint": {
      "type": "object",
      "additionalProperties": false,
      "required": ["library", "draft"],
      "properties": {
        "library": { "type": "string", "minLength": 1 },
        "draft": { "type": "string", "minLength": 1 }
      }
    },
    "history": {
      "type": "array",
      "minItems": 1,
      "items": { "$ref": "#/$defs/historyEntry" }
    }
  },
  "$defs": {
    "semver": {
      "type": "string",
      "pattern": "^(0|[1-9][0-9]*)\\.(0|[1-9][0-9]*)\\.(0|[1-9][0-9]*)$"
    },
    "sha256Hex": {
      "type": "string",
      "pattern": "^[a-f0-9]{64}$"
    },
    "sha256HexOrEmpty": {
      "type": "string",
      "pattern": "^([a-f0-9]{64}|)$"
    },
    "isoDate": {
      "type": "string",
      "pattern": "^[0-9]{4}-[0-9]{2}-[0-9]{2}$"
    },
    "memberEntry": {
      "type": "object",
      "additionalProperties": false,
      "required": ["role", "schemaPath", "schemaId"],
      "properties": {
        "role": { "type": "string", "minLength": 1 },
        "schemaPath": { "type": "string", "pattern": "^schemas/[^/]+\\.schema\\.json$" },
        "schemaId": { "type": "string", "format": "uri", "pattern": "^https://agentskeptic\\.com/schemas/" }
      }
    },
    "exampleEntry": {
      "type": "object",
      "additionalProperties": false,
      "required": ["path"],
      "properties": {
        "path": { "type": "string", "pattern": "^examples/[^\\s]+$" }
      }
    },
    "historyEntry": {
      "type": "object",
      "additionalProperties": false,
      "required": [
        "manifestVersion",
        "introducedAt",
        "memberSha256",
        "exampleSha256",
        "manifestSha256"
      ],
      "properties": {
        "manifestVersion": { "$ref": "#/$defs/semver" },
        "introducedAt": { "$ref": "#/$defs/isoDate" },
        "memberSha256": {
          "type": "object",
          "additionalProperties": false,
          "required": ["event", "toolsRegistry", "toolsRegistryExport"],
          "properties": {
            "event": { "$ref": "#/$defs/sha256Hex" },
            "toolsRegistry": { "$ref": "#/$defs/sha256Hex" },
            "toolsRegistryExport": { "$ref": "#/$defs/sha256Hex" }
          }
        },
        "exampleSha256": {
          "type": "object",
          "additionalProperties": false,
          "required": ["registry", "events"],
          "properties": {
            "registry": { "$ref": "#/$defs/sha256Hex" },
            "events": { "$ref": "#/$defs/sha256Hex" }
          }
        },
        "manifestSha256": { "$ref": "#/$defs/sha256HexOrEmpty" }
      }
    }
  }
}
